,,,,,,,,,Features,,,,,,,,,,
42,Common Teal,Anas crecca,Anatidae,Duck,Least Concern (LC),Schedule IV,Migratory,তিলে হাঁস,34–38 cm,"The Common Teal is a small dabbling duck, one of the most widespread migratory waterfowl. It has a compact body, short neck, and swift flight. It feeds on aquatic plants, seeds, and small invertebrates, often seen dabbling in shallow waters. In winter, large flocks gather in wetlands, lakes, and paddy fields.","Breeding males have chestnut head with broad green eye patch, grey body, and yellowish rear.","Females are mottled brown with pale underparts, resembling other female dabbling ducks.",Soft whistles and short quacks; males give clear “peep” notes.,"Breeds across northern Eurasia. Winters in South Asia, including India, Bangladesh, Nepal, and Sri Lanka. In West Bengal, common in wetlands, rivers, and paddy fields during winter migration.",,"Several subspecies, including A. c. crecca (Eurasia), A. c. carolinensis (North America, Green-winged Teal).","Garganey (Anas querquedula) – larger, with white eye stripe; Eurasian Wigeon (Mareca penelope).",Highly gregarious in winter; important indicator of wetland health; hunted in some regions.,Images show small duck with green eye patch (male) or mottled brown plumage (female) in wetlands.
43,Common Kestrel,Falco tinnunculus,Falconidae,Raptor,Least Concern (LC),Schedule I,Migratory,পাতি বাজ ,32–39 cm; wingspan 65–82 cm,"The Common Kestrel is a small falcon with rufous-brown upperparts, black spots, and a long tail with a black terminal band. It is known for its hovering flight while hunting small mammals, birds, and insects. It prefers open countryside, grasslands, and agricultural fields.","Males have grey head and tail, rufous back with black spots, and black terminal tail band.","Females are larger, with brown head and tail, more heavily streaked plumage.","High-pitched “kee-kee-kee” calls, especially during breeding season.","Widely distributed across Europe, Asia, and Africa. In India, including West Bengal, it is a winter visitor found in open fields, grasslands, and rural landscapes.",,"Several subspecies across its wide range (e.g., F. t. tinnunculus in Europe, F. t. rupicolus in South Asia).","Lesser Kestrel (Falco naumanni) – smaller, lacks heavy spotting; Eurasian Hobby (Falco subbuteo).",Famous for hovering flight while hunting; plays ecological role in controlling rodent populations.,Images show small falcon hovering in fields or perched with rufous back and grey head (male).
44,Eastern Yellow Wagtail,Motacilla tschutschensis,,Wagtail,Least Concern (LC),Schedule-II,Winter Migratory,হলদে খঞ্জন (Holde' khanjan),15–17 cm,"The Eastern Yellow Wagtail is a small, slender bird, known for its characteristic long, constantly wagging tail and olive-green back and yellow underparts in breeding males. Key features include a black tail with white outer feathers, a long hind claw, and a high-pitched call. Breeding males exhibit striking head patterns and a gray crown, while non-breeding birds and females are duller, though the tail and yellow may be diluted with white. They are ground-foraging insectivores.  ","During breeding males have bright yellow underparts and throat. Greenish or olive-green upperparts. Head color varies by subspecies, ranging from gray to white. A distinct white line above the eye (supercilium). Outer tail feathers are white.","During breeding females are duller, with less yellow on the underparts and more white. Head is often paler and may have a brownish tinge. Can have a more pronounced gray necklace. ",,"The Eastern Yellow Wagtail is found throughout India during its non-breeding (winter) season, from the northern states like Jammu and Kashmir and Assam to the southern tip of the peninsula, with specific sightings confirmed in states such as Kerala, Karnataka, West Bengal, and Tripura. It also occurs in the Andaman and Narcondam Islands.  ",,"Motacilla tschutschensis plexa
Motacilla tschutschensis tschutschensis
Motacilla tschutschensis taivana
Motacilla tschutschensis macronyx ",Citrine Wagtail,,
45,Eastern Cattle Egret,Bubulcus coromandus,Ardeidae,Egret,Least Concern (LC),Schedule-IV,Resident (with local seasonal movements),গো বক,48–53 cm,"The Eastern Cattle Egret is a small, stocky white heron often seen in association with grazing livestock. It feeds on insects and small animals disturbed by cattle and tractors. In breeding plumage, it develops golden-buff plumes on the head, breast, and back. It is highly adaptable, thriving in wetlands, grasslands, agricultural fields, and even urban areas.","Breeding males show golden-buff plumes on head, breast, and back, with reddish bill and legs.",Females resemble males; juveniles are plain white with yellow bill and legs.,"Harsh “rick-rick” and croaking calls, especially in colonies.","Widely distributed across South and Southeast Asia, including India, Bangladesh, Nepal, Sri Lanka, Myanmar, Thailand, Cambodia, Vietnam, and China. Often found in agricultural fields, wetlands, and near cattle.",—,B. c. coromandus,"Western Cattle Egret (Bubulcus ibis), Little Egret (Egretta garzetta)",,
46,Eurasian Collared-Dove,Streptopelia decaocto,Columbidae,Dove,Least Concern (LC),Schedule-IV,Resident (with local dispersal), কণ্ঠীঘুঘু ,32–34 cm,"The Eurasian Collared-Dove is a medium-sized dove with pale grey-buff plumage, a slender body, and a long square-tipped tail. Its most distinctive feature is the narrow black collar on the nape, bordered with white. It is highly adaptable, thriving in urban, rural, and agricultural landscapes. It feeds on grains, seeds, and small fruits, often foraging near human habitation.","Males and females are alike, both showing pale grey plumage and black collar.",Females resemble males; juveniles lack the distinct collar and are duller overall.,"Soft, repetitive three-note cooing “coo-COO-coo,” often heard in pairs or flocks.","Native to Europe and Asia; widely distributed across South Asia including India, Bangladesh, Nepal, and Sri Lanka. Introduced populations thrive in North America and other regions.",—,"S. d. decaocto, S. d. xanthocyclus","Red Collared-Dove (Streptopelia tranquebarica), Laughing Dove (Spilopelia senegalensis)",,
47,Eurasian Hoopoe,Upupa epops,Upupidae,Hoopoe,Least Concern (LC),Schedule-IV,"Migratory (breeds in Europe/Asia, winters in South Asia/Africa)",মোহনচূড়া ,25–29 cm,"The Eurasian Hoopoe is a distinctive bird with cinnamon-orange plumage, bold black-and-white wings, and a long, slender, down-curved bill. Its most striking feature is the erectile crest tipped with black, which fans out when excited. It feeds mainly on insects, grubs, and small invertebrates, probing the ground with its bill. Often seen in open fields, grasslands, and rural areas.",Males are cinnamon-orange with black-and-white wings and a prominent crest.,Females resemble males but may appear slightly duller; juveniles have shorter crests and paler plumage.,"Soft “hoo-poo-poo” calls, repeated in series; alarm calls are harsher.","Widely distributed across Europe, Asia, and North Africa. In South Asia, including India and Bangladesh, it is a winter visitor and passage migrant.",—,"U. e. epops, U. e. africana, U. e. asiatica, U. e. senegalensis","Indian Hoopoe (Upupa indica – sometimes treated as subspecies), Woodpeckers (superficially similar in crest and bill use)",,
48,Eurasian Moorhen / Common Moorhen,Gallinula chloropus,Rallidae,Rail,Least Concern (LC),Schedule-IV,Resident (with local seasonal movements),জলমুরগি (Jalmurgi),32–35 cm,"The Eurasian Moorhen is a medium-sized waterbird with dark brownish-black plumage, white undertail coverts, and a distinctive red bill with yellow tip. It has long greenish legs with unwebbed toes, adapted for walking on floating vegetation. It is omnivorous, feeding on aquatic plants, insects, and small fish. Often seen swimming in ponds, marshes, and wetlands, flicking its white undertail feathers.","Males are similar to females, both showing dark plumage and red bill.",Females resemble males; juveniles are dull brown with paler underparts and lack the bright bill coloration.,"Loud, harsh “kurr-kurr” and “krek-krek” calls; also emits sharp alarm notes.","Widely distributed across Europe, Asia, and Africa. In South Asia, including India, Bangladesh, Nepal, and Sri Lanka, it is common in wetlands, ponds, and rice fields.",—,"G. c. chloropus, G. c. orientalis, G. c. pyrrhorrhoa","Common Coot (Fulica atra), Purple Swamphen (Porphyrio poliocephalus)",,
49,Eurasian Wigeon,Mareca penelope,Anatidae,Duck,Least Concern (LC),Schedule-IV,"Migratory (breeds in northern Eurasia, winters in South Asia)",ছোট লালশির ,45–50 cm,"The Eurasian Wigeon is a medium-sized dabbling duck with a rounded head and short bill. It is often seen in large flocks on lakes, marshes, and coastal wetlands during winter. It feeds mainly on aquatic plants and grasses, grazing in shallow water or on land.","Breeding males have a chestnut head with creamy-yellow forehead, grey body, pinkish breast, and white wing patch visible in flight.",Females are mottled brown with a paler face and less distinct markings; juveniles resemble females.,Whistling “wee-oo” notes by males; females give low growls and quacks.,"Breeds across northern Europe and Asia. Winters in South Asia, including India, Bangladesh, Nepal, and Sri Lanka, as well as Africa and the Middle East. Prefers lakes, reservoirs, marshes, and coastal lagoons.",—,Monotypic (no widely recognized subspecies).,"American Wigeon (Mareca americana), Gadwall (Mareca strepera)",,
50,Eurasian Wryneck,Jynx torquilla,Picidae,Woodpecker (non-drumming),Least Concern (LC),Schedule-IV,"Migratory (breeds in Europe/Asia, winters in Africa/South Asia)",বঙ্কিমগ্রীব ,16–18 cm,"The Eurasian Wryneck is a small, cryptically patterned woodpecker with mottled brown, grey, and buff plumage that provides excellent camouflage against tree bark. Unlike other woodpeckers, it does not drum but has a long, flexible tongue for feeding on ants and insects. Its name comes from its ability to twist its head in a snake-like manner when threatened.",Males are mottled brown and grey with subtle barring and streaks; plumage is cryptic and similar to females.,Females resemble males; juveniles are duller with heavier streaking.,"Loud, repeated “quee-quee-quee” calls; alarm calls are harsh and rasping.","Breeds across Europe and northern Asia; winters in Africa, the Middle East, and South Asia including India. Found in open woodlands, orchards, and scrublands.",—,"J. t. torquilla, J. t. chinensis, J. t. sarudnyi, J. t. tschusii","Grey-headed Woodpecker (Picus canus), Lesser Spotted Woodpecker (Dryobates minor)",,
51,Fulvous-breasted Woodpecker,Dendrocopos macei,Picidae,Woodpecker,Least Concern (LC),Schedule-IV,Resident,জরদ কাঠঠোকরা ,20–22 cm,"A medium-sized woodpecker with buffy underparts, black-and-white barred wings, and a distinctive fulvous (yellowish-buff) breast. It has a strong bill for drilling into wood and feeds on insects, larvae, and occasionally fruits. Often seen clinging to tree trunks and branches in forests, groves, and wooded gardens.",Males have a red crown patch along with buff breast and black-and-white barred wings.,Females lack the red crown patch but otherwise resemble males; juveniles are duller with less distinct barring.,Sharp “kik-kik” calls and drumming on tree trunks.,"Found across the Indian subcontinent, including India, Bangladesh, Nepal, Bhutan, and Myanmar. Prefers forests, wooded areas, plantations, and urban groves.",—,"D. m. macei, D. m. himalayensis","Black-rumped Flameback (Dinopium benghalense), Lesser Yellownape (Picus chlorolophus)",,
52,Glossy Ibis,Plegadis falcinellus,Threskiornithidae,Wader,Least Concern (LC),Schedule IV,Migratory,দ্যুতি ,55–65 cm; wingspan 88–105 cm,"The Glossy Ibis is a medium-sized wading bird with long legs and a slender, down-curved bill. Its plumage appears dark at a distance but shines with bronze, green, and purple iridescence in good light. It feeds in shallow wetlands, probing mud for insects, crustaceans, and small fish.",Males and females look alike; both have iridescent plumage and long decurved bill.,Females are similar to males; sexual dimorphism is minimal.,"Nasal, grunting “grrr” calls, often in colonies.","Widely distributed across Europe, Africa, Asia, and Australia. In India, including West Bengal, it is a winter visitor found in wetlands, marshes, and paddy fields.",,Monotypic (no recognized subspecies).,"Black-headed Ibis (Threskiornis melanocephalus) – larger, white plumage; Eurasian Curlew (Numenius arquata) – longer bill, different plumage.",Often breeds in colonies with other herons and ibises; highly gregarious in winter.,"Images show dark ibis with bronze-green iridescence, long legs, and decurved bill in wetlands."
53,Gray-headed Swamphen,Porphyrio poliocephalus,Rallidae,Rail,Least Concern (LC),Schedule-IV,Resident (with local dispersal),ধূসর-মাথা জলমুরগি (Dhushor-matha Jalmurgi),45–50 cm,"A large, striking rail with purplish-blue body, gray head, and long red bill with frontal shield. It has long reddish legs and unwebbed toes, adapted for walking on floating vegetation. It feeds on aquatic plants, shoots, and small animals. Often seen in wetlands, ponds, and marshes, flicking its tail to reveal white undertail coverts.","Males are similar to females, both showing gray head and purplish-blue body.",Females resemble males; juveniles are duller with brownish tones and less vivid coloration.,"Loud, harsh “korr-korr” and “kek-kek” calls; also emits sharp alarm notes.","Found across South Asia, including India, Bangladesh, Nepal, and Sri Lanka. Prefers wetlands, marshes, ponds, and rice fields.",—,Monotypic (no widely recognized subspecies).,"Purple Swamphen (Porphyrio porphyrio), Eurasian Moorhen (Gallinula chloropus)",,
54,Greater Coucal,Centropus sinensis,Cuculidae,Large cuckoo,Least Concern (LC),Schedule-IV,Resident,কুবো ,45–48 cm,"A large, crow-like cuckoo with glossy black head, neck, and body, contrasted by rich chestnut wings. It has a long, broad tail and red eyes. Prefers dense vegetation, scrub, and gardens, where it skulks low to the ground. Feeds on insects, caterpillars, small reptiles, and occasionally fruits. Known for its deep, resonant calls.",Males are glossy black with chestnut wings and long black tail.,"Females resemble males; juveniles are streaked brown and buff, with duller plumage.","Deep, resonant “coop-coop-coop” calls, often repeated in series.","Widely distributed across South and Southeast Asia, including India, Bangladesh, Nepal, Sri Lanka, Myanmar, Thailand, Cambodia, and southern China. Found in scrublands, forests, and urban gardens.",—,"C. s. sinensis, C. s. bubutus, C. s. intermedius","Lesser Coucal (Centropus bengalensis), Crow Pheasant (local name for Greater Coucal itself)",,
55,Greenish Warbler,Phylloscopus trochiloides,Phylloscopidae,Leaf Warbler,Least Concern (LC),Schedule-IV,"Migratory (breeds in temperate Eurasia, winters in South Asia)",সবুজ পাতি-চটক (Sobuj Pati-Chotok),10–11 cm,"A small, active leaf warbler with greenish upperparts, whitish underparts, and a faint wing bar. It is restless, flitting among foliage in forests and gardens, feeding on insects and spiders. Known for its complex song and subtle plumage differences across populations.","Males are similar to females, both showing greenish upperparts and whitish underparts; males sing prominently during breeding season.",Females resemble males; juveniles are duller with less distinct wing markings.,"High-pitched, varied trills and warbling notes; song is complex and melodious.","Breeds across northern and central Eurasia; winters in South Asia including India, Bangladesh, Nepal, and Sri Lanka. Found in forests, woodlands, and gardens.",—,"P. t. trochiloides, P. t. viridanus, P. t. ludlowi, P. t. plumbeitarsus","Hume’s Leaf Warbler (Phylloscopus humei), Arctic Warbler (Phylloscopus borealis)",,
56,Grey Wagtail,Motacilla cinerea,Motacillidae,Wagtail,Least Concern (LC),Schedule-IV,"Migratory (breeds in Europe/Asia, winters in South Asia)",ধূসর খঞ্জন (Dhushor Khanjan),18–20 cm,"A slender wagtail with long tail, grey upperparts, yellow underparts, and white supercilium. It is often seen near fast-flowing rivers, streams, and wetlands, constantly wagging its tail. Feeds mainly on insects and aquatic invertebrates.","Breeding males have bright yellow underparts, grey upperparts, and black throat patch.",Females are similar but lack the black throat; juveniles are duller with paler yellow underparts.,Sharp “tsree-tsree” calls; song is a series of high-pitched notes.,"Breeds across Europe and temperate Asia; winters in South Asia including India, Bangladesh, Nepal, and Sri Lanka. Prefers riversides, streams, and wetlands.",—,"M. c. cinerea, M. c. melanope","Citrine Wagtail (Motacilla citreola), Yellow Wagtail (Motacilla flava)",,
57,Gadwall,Mareca strepera,Anatidae,Duck,Least Concern (LC),Schedule-II,Winter Migratory,পিয়াং হাঁস (Piyang Hans),46-56 cm,"The gadwall is a medium-sized, drab brown duck found worldwide in freshwater wetlands. They are dabbling ducks that feed primarily on aquatic plants, often found in pairs or small flocks in shallow wetlands, and are relatively quiet with a hoarse whistling call in males and a mallard-like quack in females. ","The male Gadwall has a finely barred, grayish body with a black rear end and a light chestnut wing patch. Its head is light grayish-brown, and the bill ranges from slaty blue to black, sometimes showing faint traces of muted orange along the sides. The voice is characterized by a low, raspy squawk.","The female Gadwall has mottled brown and buff plumage, resembling a female Mallard but distinguished by its white speculum and white belly. Her bill is thinner than that of a Mallard, marked with a narrow orange stripe along the edge and small dark spots. A white wing patch is also present, though it is smaller and less prominent than in the male.",,"Indian subcontinent, including Maharashtra, West Bengal, Gujarat, and other locations where suitable wetlands exist for their wintering grounds",,"Mareca strepera strepera
Mareca strepera couesi","Garganey
Tufted Duck",,
58,Garganey,Spatula querquedula,Anatidae,Duck,Least Concern (LC),Schedule-II,Winter Migratory,জিরিয়া হাঁস ,37–41 cm,"The garganey is a small, mid-sized dabbling duck that breeds across Europe and Asia in flooded fields and wetlands, with males distinguished by a prominent white stripe above the eye, contrasting with a dark brown head.","It has a brownish head with a distinct reddish tone and a prominent white crescent above the eye. The breast is brownish, while the flanks and scapular feathers are grey. The wings display a pale blue speculum with white borders, which becomes especially striking in flight. The bill is grey, and during the breeding season it is noted for its distinct crackling or rattling mating call.","The female is overall mostly brown with less distinct markings than the male. Its head shows a more contrasting facial pattern, featuring a paler eyebrow, a darker eye-stripe, and an unstreaked whitish throat. The bill is distinctive, being longer and entirely grey. The wings appear darker grey compared to the rest of the body. While it can be confused with female Common Teals, it is distinguished by its bolder facial markings and the tendency to shake its head more frequently when dabbling.",,"Garganeys are migratory birds found in Indian states like West Bengal, Telangana, Karnataka, Rajasthan, and Tamil Nadu during the winter months. They are typically observed in wetlands and shallow lakes.",,Monotype,"Gadwall
Tufted Duck",,
59,Golden Oriole,Oriolus kundoo,Oriolidae,Oriole,Least Concern (LC),Schedule-II,Partially Migratory,সোনা বউ (Sona Bou),24-25 cm,"Golden Oriole is a medium-sized bird known for its brilliant golden-yellow plumage, contrasted by black wings and an eye-stripe. Bill is distinctive fleshy pink or dark pink color & iris is bright red color for both sexes.  These birds are insectivores and frugivores, feeding on fruits and insects.","Bright golden-yellow with velvety black wings and outer tail feathers, a prominent black eye-stripe, and a prominent yellow carpal patch on the folded wing. ","A duller, streaked yellowish-green, with brownish wings and a yellowish tail. ",,"The Indian Golden Oriole breeds in Northern and Central India and Central Asia, arriving in April-May and departing in August-September. In winter, these populations migrate to Southern India. They are also found as breeding visitors in parts of North India and Central Asia and are residents in Central and parts of Northern India, with local movements dictated by food availability. ",,Monotype,Black-hooded Oriole,,
60,Great Cormorant,Phalacrocorax carbo,Phalacrocoracidae,Cormorant,Least Concern (LC),Schedule-II,Partially Migratory,পানকৌড়ি (Pānkauri),80-100 cm,"The Great Cormorant is a large, stocky, black waterbird with a thick neck and a hooked beak, known for its glossy, black plumage that can have a greenish-blue sheen. Adults are distinguished by a white throat and cheek patch, with breeding adults developing white thigh patches and plumes on their heads. They have a wide global distribution, feeding mainly on fish by diving and often perching with wings outstretched to dry their non-waterproof feathers","Males can be 5-10% larger in linear dimensions and up to 20% heavier than females. Males also tend to have a deeper and longer bill, which may help them handle larger prey. ",Females are typically smaller.,,"Great Cormorant is found throughout India, inhabiting aquatic ecosystems like rivers, lakes, and marshlands across various states. While resident in many areas, populations also migrate south to Northeast India in the winter, supplementing local populations.",,"Phalacrocorax carbo carbo
Phalacrocorax carbo novaehollandiae
Phalacrocorax carbo sinensis
Phalacrocorax carbo hanedae 
Phalacrocorax carbo maroccanus
Phalacrocorax carbo lucidus","Little Cormorant
Indian Cormorant",,
61,Great Egret,Ardea alba,Ardeidae,Egret,Least Concern (LC),Schedule-II,Resident,বড় বক (Boro Bok),80-104 cm,"The Great Egret is a large, all-white wading bird with distinctive long black legs and feet, a long yellow bill, and a long, s-curved neck. Adults can reach about 1 meter in height with a 1.5-meter wingspan, weighing around 1 kg. In the breeding season, the bill may darken and the bird grows long, ornamental plumes on its back.","Males are typically larger and heavier than females, although the difference is subtle. ",Females are typically smaller.,,The Great Egret has a resident breeding population and can be found in allover Indian Subcontinent.,,"Ardea alba alba
Ardea alba melanorhynchos
Ardea alba egretta
Ardea alba modesta","Little Egret 
Cattle Egret
Intermediate Egret",,
62,Green Bee-eater,Merops orientalis,Meropidae,Bee-eater,Least Concern (LC),Schedule-II,Resident with local dispersal,সবুজ বাঁশপাতি (Shobuj Bashpati) or সবুজ সুইচোরা (Shobuj Shuichora),16-18 cm,"Green Bee-eater is a small, slender bird with bright green plumage, blood-red eyes, a black eye stripe, and a slightly curved black bill. It also features a rufous or rusty crown and neck, a bluish throat, and a black trailing edge on its wings. Adults may have long, central tail streamers, which are absent in juveniles. ","Males generally possess longer, more prominent tail streamers (elongated central tail feathers) than females, which have shorter streamers on average.","Females tend to have a paler or duller throat color compared to the brighter hues seen in males. Both sexes have a black gorget, but it is typically narrower in females.",,"Green Bee-eater is distributed widely across most of India, excluding the northwest and northeast regions, though the subspecies M. o. orientalis is found in the majority of the country. A different subspecies, M. o. beludschicus, is specifically found in northwest India (including states like Rajasthan and Haryana), while another subspecies, M. o. ferrugeiceps, is located in northeast India. ",,"Merops orientalis beludschicus
Merops orientalis orientalis
Merops orientalis ceylonicus
Merops orientalis ferrugeiceps",,,
63,Grey Heron,Ardea cinerea,Ardeidae,Heron,Least Concern (LC),Schedule-II,Resident,ধুপনি বক (Dhuponi Bok),84-102 cm,"The Grey Heron is a large, tall wading bird with a grey body, long legs, and a distinctive black stripe from its yellow eye to a dangling crest. Adults are mostly ashy-grey with a white head and neck, while immatures are duller with a dark grey head and a small crest. It features a yellow beak, a black shoulder patch, and long, spindly legs that it tucks close to its body during flight.",Males are generally larger and heavier than females. ,Females are generallly smaller.,,"The Grey Heron is a widespread resident across India, inhabiting wetlands and other watery environments, except for the high-altitude Himalayas. While generally resident, it is also a winter visitor to certain areas, with breeding colonies recorded in states like Rajasthan, Tamil Nadu, Maharashtra, and even Kerala. ",,"Ardea cinerea cinerea
Ardea cinerea jouyi
Ardea cinerea firasa
Ardea cinerea monicae",,,
