,,,,,,,,,Features,,,,,,,,,,
Sl. No.,Common Name,Scientific Name,Family,Category,IUCN Status,Wildlife Protection Act schedule,Migratory Status,Local Bengali Name,Size (Aprox),Description,Male Description ,Female Description,Call (Audio Fiiles),Distribution,Range Map,Subspecies,Similar Species,Note,Gallery
1,Asian Brown Flycatcher,Muscicapa dauurica,Muscicapidae,Flycatcher,Least Concern (LC),Schedule-II,Migratory,পাটকিলে চুটকি ,13-15 cm,"The Asian Brown Flycatcher is a plain, medium-sized bird characterized by its overall brownish plumage, a prominent white eyering, and a large-eyed appearance. It has an unmarked throat and underparts, but juvenile birds display buff-spotted upperparts and a breast with faint scaling. The species has shorter, plainer wings compared to similar brown flycatchers and is known for flicking its tail and wings when perched. It prefers broadleaf forests and is often found in more open areas during migration.  ","Males may have a slightly more vivid or striking plumage, although this is not a consistent or significant difference.","Females may show a slightly paler or more grayish throat and a generally duller, more uniform underparts compared to males.",,"The Asian Brown Flycatcher is a breeding summer visitor to Sikkim, Arunachal Pradesh, and the northeast Indian states like Assam, Nagaland, Meghalaya, Manipur, and Mizoram. It winters in peninsular India, particularly the Western Ghats and the midlands of Southwest India, with some birds also found in the Andaman and Nicobar Islands. During the non-breeding season, it can also be found as a passage migrant throughout the peninsula and in parts of the Indo-Gangetic plains. ",,"Muscicapa dauurica dauurica
Muscicapa dauurica poonensis
Muscicapa dauurica siamensis","Taiga Flycatcher
Blue-throated Flycatcher",,
2,Asian Koel,Eudynamys scolopaceus,Cuculidae,Cuckoo,Least Concern (LC),Schedule-II,Migratory,কোকিল (Kokil),39-46 cm,"The Asian koel is a large, cuckoo-family bird recognized by its distinct sexual dimorphism: males are glossy black with a pale bill, while females are brown, speckled with white, and have cream-colored underparts with dark bars. Both sexes share striking crimson eyes and a long tail, but are generally secretive, found in dense trees across South and Southeast Asia, and are known for their characteristic loud ""ko-el"" call. A brood parasite, the koel lays its eggs in other birds' nests, often crows', leaving them to raise the young koel chicks. ",Plumage: Glossy blue-black. Eyes: Striking crimson. Bill: Dull lime-green or pale. Tail: Long.,"Plumage: Predominantly dark brown upperparts with pale streaks and spots. Her underparts are barred with creamy-white. Eyes: Striking crimson. Bill: Pale, similar to the male. Tail: Long.",,almost all over India,,"Eudynamys scolopaceus scolopaceus
Eudynamys scolopaceus chinensis
Eudynamys scolopaceus harterti 
Eudynamys scolopaceus malayanus 
Eudynamys scolopaceus corvinus
Eudynamys scolopaceus mindanensis ",,,
3,Asian Openbill,Anastomus oscitans,Ciconiidae,Stork,Least Concern (LC),Schedule-II,Local Migratory,শামুক খোল (Shamuk Khol),68 cm,"Asian Openbill is a medium-sized stork, known for its distinctive greyish-white plumage with glossy black wings and tail. Its most recognizable feature is the open gap between the upper and lower mandibles of its dull, yellow-grey bill, a unique adaptation for feeding on snails.",Males have dark-colored irises.,Females have yellow irises.,,"The Asian Openbill stork is widespread throughout India, especially in wetland and agricultural areas of the North Indian plains (from Gujarat to Assam), the East and South Indian Peninsula, West Bengal, and Kerala",,Monotype,,,
4,Alexandrine Parakeet,Psittacula eupatria,Psittaculidae,Parakeet,Least Concern (LC),Schedule-IV,Resident,চন্দনা ,53–58 cm,"The Alexandrine Parakeet, also known as the Alexandrine Parrot, is one of the largest parakeets in Asia. It has predominantly green plumage, a long tail tipped with yellow, and a large red beak with a paler tip. A distinctive maroon patch is present on the shoulders, and males display a rose-pink collar with a black stripe across the lower cheek. Females and juveniles lack the collar and are generally duller. This species is named after Alexander the Great, who is said to have transported these birds from Punjab to Europe. It inhabits forests, woodlands, plantations, and urban parks.","Males are bright green with a rose-pink collar and black cheek stripe, plus a maroon shoulder patch.","Females are duller, lack the collar and cheek stripe, and have shorter tails. Juveniles resemble females.","Loud, harsh screams and screeches, often heard in flight or when perched in flocks.","Native to South and Southeast Asia: widespread across India, Sri Lanka, Afghanistan, Pakistan, Myanmar, Thailand, and the Andaman Islands. Common in northern India and large flocks occur in the Andamans. Declining in Sri Lanka.",—,"P. e. eupatria, P. e. nipalensis, P. e. magnirostris, P. e. avensis, P. e. siamensis","Rose-ringed Parakeet (Psittacula krameri), Plum-headed Parakeet (Psittacula cyanocephala)",,
5,Ashy Woodswallow,Artamus fuscus,Artamidae,Woodswallow,Least Concern (LC),Schedule-IV,Migratory (partial),তালচটক,18–20 cm,"The Ashy Woodswallow, also called the Ashy Swallow-shrike, is a compact bird with ashy-grey plumage, a darker head, and a narrow pale rump band. Its underside is soft pinkish-grey, and the short tail is slaty black tipped with white. It has a silvery finch-like bill, long triangular wings, and short legs. Often seen perched in tight groups on wires or tall trees, especially palms. Juveniles show barring on the underside.","Males and females look alike, both showing the same ashy-grey plumage and maroon shoulder patch absent.",Females are indistinguishable from males; no sexual dimorphism noted.,"Loud, harsh chattering calls; soft twittering when in flocks.","Found across South Asia including India, Sri Lanka, Nepal, Bangladesh, Myanmar, and Thailand. Common in open country, farmlands, plantations, and urban areas.",—,No recognized subspecies; plumage uniform across range.,"Dusky Woodswallow (Artamus cyanopterus), White-breasted Woodswallow (Artamus leucorynchus)",,
6,Asian Green Bee-eater,Merops orientalis,Meropidae,Bee-eater,Least Concern (LC),Schedule-IV,Resident (with local movements),সবুজ বাঁশপাতি (Sabuj Bashpati) ,16–18 cm,"The Asian Green Bee-eater is a slender, brightly colored bird with vivid green plumage, long pointed wings, and elongated central tail feathers. It has a narrow black throat band, a golden-green crown, and a black eye-stripe that enhances its striking appearance. The bill is long, slightly curved, adapted for catching insects mid-air. Often seen perched on wires or exposed branches, it makes swift sallies to snatch bees, wasps, and other flying insects.",Males are similar to females but often show longer central tail streamers and slightly brighter plumage.,"Females are nearly identical to males, though tail streamers are shorter and plumage may appear a little duller.","Sharp, repetitive “trill” or “tree-tree” calls, often heard in flocks.","Widely distributed across South Asia, including India, Bangladesh, Sri Lanka, Pakistan, Nepal, and Myanmar. Common in open countryside, farmlands, scrublands, and urban areas.",—,"M. o. orientalis, M. o. ferrugeiceps, M. o. viridissimus, M. o. beludschicus","Blue-cheeked Bee-eater (Merops persicus), Little Green Bee-eater (Merops pusillus)",,
7,Asian Palm-Swift,Cypsiurus balasiensis,Apodidae,Swift,Least Concern (LC),Schedule-IV,Resident (with local movements),তাল চড়াই,13–15 cm,"The Asian Palm-Swift is a slender, fast-flying bird with long, narrow wings and a deeply forked tail. Its plumage is pale brownish-grey above and whitish below, blending well with open skies. It is closely associated with palm trees, where it builds nests attached to hanging fronds using saliva. The species is highly aerial, spending most of its life in flight, feeding on small insects caught mid-air.","Males and females are alike in plumage, both showing slender bodies and forked tails.",No sexual dimorphism; females resemble males.,"High-pitched twittering and rapid squeaky calls, often heard in flight.","Found widely across South and Southeast Asia, including India, Sri Lanka, Bangladesh, Myanmar, Thailand, Cambodia, and Vietnam. Common in open country, farmlands, and urban areas with palms.",—,"C. b. balasiensis, C. b. infumatus","Little Swift (Apus affinis), House Swift (Apus nipalensis)",,
8,Asian Pied Starling,Gracupica contra,Sturnidae,Starling,Least Concern (LC),Schedule-IV,Resident,গো শালিক / গোবরে শালিক,22–25 cm,"The Asian Pied Starling, also known as the Pied Myna, is a medium-sized bird with striking black-and-white plumage and a bright orange-red bill with a yellow base. It has a glossy black head, neck, and upperparts, contrasting with white face patches and underparts. The wings are black with white patches visible in flight, and the tail is black tipped with white. It is highly social, often seen in pairs or small flocks, and is known for its melodious, varied calls.","Males and females are similar in plumage, both showing the same black-and-white contrast and bright bill.",Females are indistinguishable from males; no sexual dimorphism noted.,"Rich, varied whistles, chatters, and melodious notes; often mimics other sounds.","Widely distributed across South Asia, including India, Nepal, Bangladesh, Sri Lanka, and Myanmar. Common in farmlands, villages, towns, and open countryside.",—,"G. c. contra, G. c. superciliaris, G. c. sordida, G. c. andamanensis","Common Myna (Acridotheres tristis), Bank Myna (Acridotheres ginginianus)",,
9,Asian Tit (Cinereous Tit),Parus cinereus,Paridae,Tit,Least Concern (LC),Schedule-IV,Resident,রূপালী টুই ,13–14 cm,"The Cinereous Tit, also known as the Asian Tit, is a small, active bird with a black head, throat, and bib, contrasting with white cheeks and underparts. Its upperparts are greyish, and the wings show pale edging. It is agile, often seen hopping among branches or hanging upside down while foraging for insects, seeds, and small fruits. It is a common garden and woodland bird, frequently visiting feeders and nesting in tree cavities or artificial nest boxes.",Males are similar to females but may show slightly glossier black plumage on the head and bib.,"Females resemble males, though the black bib may be narrower and less glossy.","Loud, varied calls including “chee-chee” notes and scolding chatter; also produces a rapid trill.","Widely distributed across South Asia, including India, Nepal, Bangladesh, Sri Lanka, and Myanmar. Found in gardens, forests, plantations, and urban areas.",—,"P. c. cinereus, P. c. stupae, P. c. mahrattarum, P. c. bokharensis","Great Tit (Parus major), Green-backed Tit (Parus monticolus)",,
10,Baya Weaver,Ploceus philippinus,Ploceidae,Weaverbird,Least Concern (LC),Schedule-IV,Resident (with local movements),বাবুই (Babui),15–17 cm,"The Baya Weaver is a small, sparrow-sized bird famous for its intricately woven hanging nests. It has a stout conical bill and a preference for colonies near water bodies, grasslands, and agricultural fields. During breeding, males develop bright yellow plumage on the crown and breast, contrasting with brown upperparts and streaked underparts. Outside the breeding season, both sexes appear dull brown and resemble sparrows. Their nests, suspended from palm fronds or thorny trees, are masterpieces of weaving, with a long vertical entrance tube.","Breeding males show bright yellow crown, breast, and darker mask with strong contrast against brown wings and streaked underparts.","Females and non-breeding males are dull brown, streaked, and sparrow-like, lacking the bright yellow crown.","A series of harsh “chee-chee” notes and chattering calls, often heard around colonies.","Widely distributed across South and Southeast Asia, including India, Nepal, Bangladesh, Sri Lanka, Myanmar, Thailand, and Cambodia. Common in farmlands, grasslands, wetlands, and villages.",—,"P. p. philippinus, P. p. burmanicus, P. p. travancoreensis, P. p. sinhalensis","House Sparrow (Passer domesticus), Streaked Weaver (Ploceus manyar)",,
11,Bengal Bushlark,Mirafra assamica,Alaudidae,Lark,Least Concern (LC),Schedule-IV,Resident,ভরত ,15–16 cm,"The Bengal Bushlark is a small, inconspicuous bird with streaked brown upperparts, pale underparts with fine streaking, and a short tail. It has a heavy bill and rounded wings, adapted for short flights. Often seen on the ground or low shrubs, it blends well with dry grasslands and scrub habitats. During breeding, males perform aerial song flights, rising and fluttering while delivering melodious notes.",Males are similar in plumage but perform distinctive display flights and may show slightly richer tones.,"Females resemble males, with no marked differences in plumage.","Rich, varied warbling song delivered during aerial displays; also produces short chirps and whistles.","Found across the Indian subcontinent, including India, Bangladesh, Nepal, and Sri Lanka. Common in dry grasslands, scrublands, farmlands, and open countryside.",—,"M. a. assamica, M. a. marionae, M. a. jerdoni","Jerdon’s Bushlark (Mirafra jerdoni), Indian Bushlark (Mirafra erythroptera)",,
12,Black Bittern,Ixobrychus flavicollis,Ardeidae,Bittern,Least Concern (LC),Schedule-IV,Resident (with local movements),কালো বক (Kalo Bok),60–65 cm,"The Black Bittern is a medium-sized heron-like bird with dark, sooty-black plumage and a long neck. It has a distinctive golden-yellow throat and sides of the neck, contrasting with its otherwise dusky appearance. The bill is long and pointed, adapted for spearing fish and aquatic prey. It is secretive, often concealed in dense reed beds or mangroves, and flies with rapid wingbeats when flushed.","Males are similar to females, both showing dark plumage with golden throat markings.",Females resemble males; no marked sexual dimorphism. Juveniles are browner with streaked plumage.,"Harsh croaking and booming calls, usually heard at dusk or night.","Found across South and Southeast Asia, including India, Bangladesh, Sri Lanka, Nepal, Myanmar, Thailand, Cambodia, Indonesia, and the Philippines. Prefers wetlands, marshes, reed beds, and mangroves.",—,No distinct subspecies widely recognized; plumage consistent across range.,"Yellow Bittern (Ixobrychus sinensis), Chestnut Bittern (Ixobrychus cinnamomeus)",,
13,Black Drongo,Dicrurus macrocercus,Dicruridae,Drongo,Least Concern (LC),Schedule-IV,Resident (with local movements),কালো ফিঙে (Kalo Phinge),28–30 cm,"The Black Drongo is a medium-sized, entirely black bird with a distinctive forked tail and glossy plumage. It is fearless and aggressive, often mobbing larger raptors and protecting its territory. Known as the “farmer’s friend,” it feeds on insects and is commonly seen perched on wires, poles, or open branches in agricultural landscapes. Its flight is agile and graceful, with frequent sallies to catch prey mid-air.",Males are glossy jet-black with a deeply forked tail.,Females resemble males but may appear slightly duller; juveniles are brownish-black with less gloss.,"Harsh, metallic “chee-chee” notes and varied whistles; alarm calls are sharp and scolding.","Widely distributed across South Asia, including India, Nepal, Bangladesh, Sri Lanka, Pakistan, and Myanmar. Found in open fields, farmlands, villages, and urban areas.",—,"D. m. macrocercus, D. m. albirictus, D. m. cathoecus, D. m. harterti","Ashy Drongo (Dicrurus leucophaeus), White-bellied Drongo (Dicrurus caerulescens)",,
14,Black-naped Oriole,Oriolus chinensis,Oriolidae,Oriole,Least Concern (LC),Schedule-IV,Migratory (partial),বেনে বউ / হলুদ পাখি,25–28 cm,"The Black-naped Oriole is a strikingly beautiful bird with bright golden-yellow plumage, contrasting black wings edged with yellow, and a distinctive black stripe running from the bill through the eye to the nape. It has a pinkish bill and red eyes, making it highly conspicuous. Agile and arboreal, it is often seen in the canopy of tall trees, feeding on fruits, berries, insects, and nectar. Its melodious fluting calls are a hallmark of summer woodlands.","Males are vivid golden-yellow with a bold black eye-stripe and nape, plus brighter plumage overall.","Females are slightly duller, with more greenish tones on the back and less vivid yellow underparts. Juveniles are streaked and less brightly colored.","Rich, fluty whistles and melodious notes, often repeated in series.","Widely distributed across South and Southeast Asia, including India (northeast and eastern states), Bangladesh, Myanmar, Thailand, Cambodia, Vietnam, and the Philippines. In India, it is a summer visitor to the northeast and migrates locally.",—,"O. c. chinensis, O. c. diffusus, O. c. maculatus, O. c. yamamurae","Eurasian Golden Oriole (Oriolus oriolus), Slender-billed Oriole (Oriolus tenuirostris)",,
15,Black-rumped Flameback,Dinopium benghalense,Picidae,Woodpecker,Least Concern (LC),Schedule-IV,Resident,সুবর্ণ কাঠঠোকরা ,30–34 cm,"The Black-rumped Flameback, also known as the Lesser Golden-backed Woodpecker, is a striking bird with golden-yellow upperparts, a black rump, and bold black-and-white facial markings. It has a long, straight bill adapted for drilling into wood, and a stiff tail that supports it while climbing tree trunks. The species is noisy and conspicuous, often drumming on trees and calling loudly. It inhabits open forests, groves, plantations, and urban areas.","Males have a bright crimson crest, contrasting with golden upperparts and black rump.",Females resemble males but have a black crest streaked with white instead of crimson. Juveniles are duller with streaked plumage.,"Loud, sharp “ki-ki-ki” calls and rapid drumming on wood.","Widely distributed across the Indian subcontinent, including India, Nepal, Bangladesh, Sri Lanka, and Pakistan. Common in open woodlands, farmlands, and urban parks.",—,"D. b. benghalense, D. b. dilutum, D. b. puncticolle, D. b. psarodes","Greater Flameback (Chrysocolaptes guttacristatus), Himalayan Flameback (Dinopium shorii)",,
16,Black-winged Kite,Elanus caeruleus,Accipitridae,Raptor,Least Concern (LC),Schedule-I,Resident (with local movements),কাটুয়া চিল,31–35 cm,"The Black-winged Kite is a small, graceful raptor with pale grey and white plumage, striking red eyes, and bold black patches on the shoulders and wings. It is known for its hovering flight, often seen suspended in the air while scanning for prey. Its diet mainly consists of rodents, small reptiles, and large insects, making it a beneficial bird in agricultural landscapes.","Males are similar to females, both showing pale grey upperparts, white underparts, and black shoulder patches.",Females resemble males; juveniles are buffy with streaked plumage and less distinct wing markings.,"High-pitched whistles and harsh “kree-kree” calls, especially during breeding season.","Widely distributed across Africa, South Asia, and Southeast Asia. In India, it is common in open grasslands, farmlands, scrublands, and semi-arid regions.",—,"E. c. caeruleus, E. c. vociferus, E. c. hypoleucus","White-tailed Kite (Elanus leucurus), Black-shouldered Kite (Elanus axillaris)",,
17,Blue-throated Barbet,Psilopogon asiaticus,Megalaimidae,Barbet,Least Concern (LC),Schedule-IV,Resident,নীলকণ্ঠ  বসন্তবৌরি,20–22 cm,"The Blue-throated Barbet is a brightly colored bird with vivid green plumage, a turquoise-blue throat and face, crimson forehead and crown, and yellowish streaks on the sides of the head. It has a stout bill adapted for fruit-eating and is often heard before being seen, thanks to its loud, repetitive calls. It inhabits wooded areas, orchards, and gardens, feeding mainly on fruits, berries, and insects.",Males are brightly colored with vivid blue throat and crimson crown.,"Females resemble males, with no significant sexual dimorphism. Juveniles are duller, with less distinct coloration.","Loud, repetitive “kutroo-kutroo” or “tuk-tuk” notes, often heard in summer.","Found across the Indian subcontinent and Southeast Asia, including India, Nepal, Bangladesh, Bhutan, Myanmar, Thailand, Laos, Cambodia, and Vietnam. Common in forests, plantations, and urban gardens.",—,"P. a. asiaticus, P. a. laosensis","Coppersmith Barbet (Psilopogon haemacephalus), Great Barbet (Psilopogon virens)",,
18,Bluethroat,Luscinia svecica,Muscicapidae,Thrush-like songbird,Least Concern (LC),Schedule-IV,Migratory,নীলগলা ফিদ্দা,13–14 cm,"The Bluethroat is a small, striking songbird known for its vivid throat patch. It has brown upperparts, a white supercilium, and reddish flanks. The male’s throat is bright blue bordered by black and rust-red, often with a central white or rufous spot depending on subspecies. It is a ground-dwelling bird, often flicking its tail to reveal rufous patches. It breeds in wetlands and scrub across Europe and Asia, migrating to South Asia in winter.","Males are distinguished by their brilliant blue throat bordered with black and chestnut, often with a central spot.","Females lack the vivid blue throat, showing buffy or whitish underparts with faint streaking. Juveniles resemble females.","Rich, varied warbling song with mimicry; sharp “chak” call when alarmed.","Breeds across northern Europe and Asia. Winters in South Asia including India, Bangladesh, Nepal, and Pakistan. Found in reed beds, scrublands, and agricultural fields during migration.",—,"L. s. svecica, L. s. cyanecula, L. s. magna, L. s. namnetum","Red-flanked Bluetail (Tarsiger cyanurus), Siberian Rubythroat (Calliope calliope)",,
19,Barn Swallow,Hirundo rustica,Hirundinidae,Swallow & Martins,Least Concern (LC),Schedule-II,Winter Migratory,আবাবিল,17-19 cm,"Barn Swallow is a small, acrobatic bird with glossy steel-blue upperparts, a rusty-red forehead and throat, and buffy or whitish underparts. Its most distinctive feature is a long, deeply forked tail with elegant, elongated outer tail feathers.","Males have longer, more deeply forked outer tail feathers, also known as tail streamers. Males also display a richer and deeper rusty-orange or cinnamon color on their throat and underparts.  ",Femaleshave shorter tail streamers than males.Females have a paler version of the rusty-orange coloration on their throats and bellies. ,,"Barn Swallows are winter visitors to most of India, including states like West Bengal, Karnataka, Kerala, and Maharashtra, arriving from their breeding grounds in the Himalayas and beyond during the non-breeding season.",,"Hirundo rustica rustica
Hirundo rustica savignii
Hirundo rustica transitiva
Hirundo rustica tytleri
Hirundo rustica gutturalis
Hirundo rustica mandschurica
Hirundo rustica erythrogaster",,,
20,Black Kite,Milvus migrans,Accipitridae,Hawks & Eagles,Least Concern (LC),Schedule-II,Migrant,ভুবন চিল (Bhubon Chil),58-69 cm,"The Black Kite is a medium-sized bird of prey characterized by its dark brown to black plumage, forked tail, and gliding flight style. It has pale yellow legs, a black bill, dark eyes, and can be found on four continents, often near human settlements, water, and open areas where it scavenges and hunts for small mammals, fish, and carrion.  ",Males may be slightly less aggressive than females. ,Females are longer and have a larger wingspan than males. ,,Black Kites are widely distributed across most of India,,"Milvus migrans migrans
Milvus migrans govinda
Milvus migrans affinis
Milvus migrans lineatus
Milvus migrans formosanus
Milvus migrans aegyptius
Milvus migrans parasitus
",,,
21,Black-crowned Night Heron,Nycticorax nycticorax,Ardeidae,Heron,Least Concern (LC),Schedule-II,Generally Resident,নিশি বক (Nishi Bok),58-65 cm,"Black-crowned Night Heron is a stocky, medium-sized wading bird with a distinctive black back and crown, gray wings, and white underparts, bright red eyes, and short greenish-yellow legs that turn pink in the breeding season. Adults have long white plumes that extend from their heads, while immatures are brown with white spots and streaks. These nocturnal birds roost in trees by day and are active at dusk, foraging in various aquatic habitats for fish, insects, and other small animals.  ","Males are typically larger and more robust than females. During breeding season, males may have longer head plumes and a more pronounced blue-green gloss on their black head feathers. ",Fermales are typically smaller,,"The Black-crowned Night Heron,  is found across India.",,"Nycticorax nycticorax nycticorax
Nycticorax nycticorax hoactli
Nycticorax nycticorax obscurus
Nycticorax nycticorax falklandicus",Indian Pond Heron,,
